id,cost,talktime,validity,comments
6858,16,,18 days,All voice calls to Bhutan at Rs.10 paisa per second with validity of 18 days as a promotional offer for 90 days
6859,18,,30 days,All voice calls to Nepal at Rs.8.50 per min.with validity of 30days
6860,23,,30 days,"ISD calls to Australia ,Bahrain , Indonesia, Kuwait @ Rs. 6.49/min -- International SMS @ Rs.3/SMS"
6861,27,,30 days,"Bangldesh, Malaysia, Hongkong, Thailand calls Rs.2.99 Min and SMS Rs.3.0 per SMS"
6862,38,,30 days,"ISD calls to Bahrain, France, Germany, U.K** @ Rs. 4.49/min -- **These STVs are not applicable for ISD code 004470 of UK"
6863,41,,30 days,"ISD calls to Canada , U.S.A. , Singapore , China @ Rs. 1.49/min -- International SMS @ Rs.3/SMS"
